{
  "scenario_id": "L08",
  "match": true,
  "rationale": "X is correct, complete, and at least at reference quality: it explains the `found`-flag control flow for empty, sole, and multi-yield enumerables, including exact exception class and source-defined messages. It correctly shows why `GenericEnumerable.new(1..)` aborts on the second yield rather than invoking `Range#sole` or traversing an endless range, and why `nil` is data rather than an absence sentinel. Its treatment of one positional yield, multiple positional yields, and a positional value plus keywords matches both the implementation's `|*element|` packing and all focused tests, which it ran successfully.",
  "shortcomings": [],
  "strengths": [
    {
      "summary": "Control flow, short-circuiting, and nil semantics are precise.",
      "evidence": "X.md traces `result`, `found`, the second-yield raise, and the empty-enumerable raise to activesupport/lib/active_support/core_ext/enumerable.rb:238-256, and ties `[1, nil]` and the wrapped endless range to activesupport/test/core_ext/enumerable_test.rb:431-438. Direct checkout inspection confirms the second yield raises `\"multiple items found\"` at enumerable.rb:243-244 and no-yield completion raises `\"no item found\"` at :251-255."
    },
    {
      "summary": "Yield packing is explained accurately for every requested shape.",
      "evidence": "X.md explains the single-value unwrap and retained multi-value array from enumerable.rb:242 and :247, then cites enumerable_test.rb:441-458 for `yield(1, \"one\")` returning `[1, \"one\"]` and `yield 1, two: 3` returning `[1, { two: 3 }]`, each matching `first`."
    },
    {
      "summary": "The answer investigated and verified the focused behavior.",
      "evidence": "X.thread.md records `bin/test test/core_ext/enumerable_test.rb -n '/test_sole/'` completing with 3 runs, 9 assertions, 0 failures, and 0 errors, plus a direct probe of sole-nil and exception-message behavior. Independent judgment verification with `bin/test test/core_ext/enumerable_test.rb -i '/test_sole/'` also completed with 3 runs, 9 assertions, 0 failures, and 0 errors."
    }
  ],
  "judge_thread_id": "T-01a064d8-e83a-742a-b54a-e2fe9d9a5393"
}
