{
  "scenario_id": "L14",
  "match": true,
  "rationale": "X meets the requested shaping scope and accurately establishes the consequential `OrderedOptions` and `InheritableOptions` behavior from source, the complete focused test file, and direct probes of uncovered blank-value and inheritance cases. It preserves successful values, symbolized lookup, dynamic introspection, `dig`, child overrides, and ordering while defining concrete diagnostic outcomes for missing, `nil`, `false`, whitespace, inherited blanks, and local blank overrides. Its conservative decision to preserve `KeyError` could have been labeled as an open compatibility question, but it introduces no material error and the brief is at least at parity with the references overall.",
  "shortcomings": [
    {
      "summary": "It presents preservation of the exception class as settled rather than separating that conservative assumption from confirmed requirements.",
      "evidence": "X.md Desired outcome #5 and Compatibility boundaries require failed bang reads to remain `KeyError`, while the scenario explicitly freezes successful return values and general compatibility but does not specifically settle failure class identity. R1.md Open question #1 and R2.md Open question #4 leave exact `KeyError` compatibility for confirmation; X still correctly preserves current behavior, so this is a minor shaping/communication limitation rather than a correctness defect."
    }
  ],
  "strengths": [
    {
      "summary": "Its current-behavior account is comprehensive and correct across all requested access paths and blank-value boundaries.",
      "evidence": "X.md covers symbol/string assignment and lookup, dynamic readers and writers, arbitrary `respond_to?`, first-key symbolization in `dig`, missing readers, and bang reads for missing, `nil`, `false`, empty and whitespace-only strings, empty collections, `0`, and present values. These claims follow `activesupport/lib/active_support/ordered_options.rb:37-61` and `activesupport/lib/active_support/core_ext/object/blank.rb:6-58,61-93,112-195`; the independent probe reproduced `:a is blank`, `:falsey is blank`, `:missing is blank`, whitespace failure, successful `0`, arbitrary `respond_to?`, and missing `dig` returning `nil`."
    },
    {
      "summary": "It handles inheritance and Hash-like ordering with the precision the compatibility requirement needs.",
      "evidence": "X.md distinguishes inherited present and blank values, present and blank child overrides, unchanged parents, `overridden?`, and parent-first/child-only ordering with overrides retaining the parent position. This agrees with `activesupport/lib/active_support/ordered_options.rb:89-168` and `activesupport/test/ordered_options_test.rb:79-95,128-139,256-318`; the independent probe returned keys `[:a, :falsey, :b]`, merged values `{a: nil, falsey: false, b: \"child\"}`, and `overridden_a: true`."
    },
    {
      "summary": "Its investigation and shaping presentation are stronger than a source-only summary.",
      "evidence": "X.thread.md records `bin/test test/ordered_options_test.rb` passing with 34 runs and 104 assertions, then broad runtime probes for uncovered bang, `KeyError` metadata, ordering, `dig`, writer returns, raw parent-key behavior, and inheritable overrides. X.md translates that evidence into user pain, observable outcomes, non-goals, compatibility boundaries, ten concrete journeys, acceptance and contradiction signals, and open questions without proposing classes, methods, storage, or mechanics; the judge independently reran the test file with the same 34 runs and 104 passing assertions."
    }
  ],
  "judge_thread_id": "T-01a064d8-ef9b-729c-bbc9-214d8487d8a6"
}
