{
  "scenario_id": "L09",
  "match": true,
  "rationale": "X is at reference parity and reaches the correct reject verdict with direct source, test, and runtime evidence. It correctly distinguishes an omitted keyword from explicit nil, demonstrates nil's current equivalence to the empty separator, identifies gsub! as the first failure after deletion, and bounds the single-character, multi-character, and preserve_case regression scope. Its requested tests are focused and it writes no patch.",
  "shortcomings": [
    {
      "summary": "The proposed Inflector-level additions do not repeat the explicit empty-string assertion.",
      "evidence": "X's first requested Inflector case says nil should be the same as an empty separator but only invokes separator: nil; the direct empty-string assertion remains in the already-cited String-level tests. This is a minor coverage presentation choice because X verified and reported the empty-string result and the existing suite already locks it down."
    }
  ],
  "strengths": [
    {
      "summary": "The PR's redundancy premise is decisively disproved.",
      "evidence": "X explains that the hyphen default applies only when separator is omitted, while an explicit nil reaches the nil-coercion line and is intentionally converted to the documented empty-separator behavior."
    },
    {
      "summary": "The first downstream break is identified precisely.",
      "evidence": "X traces transliterate as independent of separator and identifies line 157's gsub! replacement call as the first use, reproducing TypeError: no implicit conversion of nil into String without the coercion; it correctly marks separator.empty? as only the next hypothetical failure."
    },
    {
      "summary": "Regression scope is appropriately narrow.",
      "evidence": "The answer explains that squeeze! for one-character separators, repeated multi-character collapse, edge trimming, and downcasing remain unchanged for non-nil separators, while nil with preserve_case fails at the same earlier gsub! call."
    },
    {
      "summary": "Verification is stronger than a source-only review.",
      "evidence": "The transcript reads implementation, forwarding code, fixtures, and both String and Inflector tests; runs the four focused separator tests with 32 assertions passing; probes gsub! with nil; and executes a reduced before/after implementation showing current nil/empty equivalence and the proposed deletion's TypeError."
    }
  ],
  "judge_thread_id": "T-01a0643e-9e4a-7408-ba55-06a01030364a"
}
