{
  "scenario_id": "S02",
  "judge_thread_id": "T-01a063d7-5cfe-71b7-994b-df2c5dfb6277",
  "match": true,
  "rationale": "X correctly rejects the proposal and explains that compatibility belongs to the left-hand value’s `deep_merge?` policy, matching the contract in activesupport/lib/active_support/deep_mergeable.rb:39-56. It accurately covers custom includers, block fallback, changed nested class and identity, and the Hash/Parameters failure mode; a focused in-memory execution confirmed that the proposed check changes a rejected nested value from the same `OtherWrapper` object to a new `Wrapper`. Although it omits one part of the unchanged top-level return contract, the review remains at reference quality overall and contains no material error.",
  "shortcomings": [
    {
      "summary": "X does not explicitly state the complete top-level mutation and return contract.",
      "evidence": "The scenario specifically requests mutation and return behavior, while X explains nested `dup.deep_merge!` and nested object identity but never plainly says that `deep_merge!` mutates its receiver and returns the includer’s `merge!` result. That contract is visible at activesupport/lib/active_support/deep_mergeable.rb:34-49 and is stated directly in R2."
    }
  ],
  "strengths": [
    {
      "summary": "X concisely ties the compatibility regression to concrete observable outcomes.",
      "evidence": "X identifies that the replacement exactly hardcodes `Parameters#deep_merge?` from actionpack/lib/action_controller/metal/strong_parameters.rb:1086-1088, and explains that Wrapper/OtherWrapper changes from right-object replacement to a new left-typed copy. The focused execution produced `[:current, true, OtherWrapper, true, ...]` under current behavior and `[:proposed, true, Wrapper, false, ...]` under the proposed condition, confirming its class and identity analysis."
    }
  ]
}
