{
  "scenario_id": "L02",
  "judge_thread_id": "T-01a06361-05e1-774f-ba02-898a84c7e52f",
  "match": true,
  "rationale": "X matches the references on the central model: `none` is a chainable relation carrying sticky `@none` state plus a SQL-literal fallback, while `where_clause.contradiction?` is a separate loading path. It accurately traces calculation, membership, bulk-mutation, and query-cache behavior and gives multiple valid examples where further use can execute SQL, including `or`, outer subqueries, cache versions, and inserts. Its investigation is broad and checkout-specific; the only notable presentation issue is grouping SQL compilation metadata beside actual database execution, which the bullet itself partly disambiguates and does not undermine the requested explanation.",
  "shortcomings": [
    {
      "summary": "The SQL-execution section slightly blurs compilation with round trips.",
      "evidence": "Under “SQL still happens,” X lists `to_sql` / `explain` and says they compile through the adapter; `to_sql` compiles Arel but does not execute a server query, and explaining an ordinary `none` load collects no query to EXPLAIN."
    }
  ],
  "strengths": [
    {
      "summary": "Explains the two independent empty-relation mechanisms precisely.",
      "evidence": "X distinguishes the sticky `@none` flag and its early `exec_main_query` return from the narrower empty-IN/unboundable `where_clause.contradiction?` path, and explains why the `1=0` literal remains useful for SQL shape and subqueries."
    },
    {
      "summary": "Covers all requested short circuits and query-cache state.",
      "evidence": "It gives exact grouped and ungrouped calculation results, traces both branches of `include?`, identifies immediate zero returns from `delete_all`/`update_all`, and distinguishes the outer load cache wrapper from the inner loading short circuit."
    },
    {
      "summary": "Identifies concrete ways null relations can still lead to SQL.",
      "evidence": "Examples include null-left `or`, use as a relation-valued predicate, unloaded cache-version computation, inserts and find-or-create paths, and association reads under `none.scoping`."
    }
  ]
}
