{
  "scenario_id": "L32",
  "match": false,
  "rationale": "X is unusually thorough and otherwise delivers a strong, implementation-neutral shaping brief with substantially better execution evidence than the references. However, it turns a contextless probe result into the categorical claim that a nil or omitted destination raises `ActionController::UrlGenerationError`, even though `url_for(nil)` uses the current request's route recall in a normal controller view and `button_to(\"Hello\", nil)` renders a form targeting the current path. Because nil URLs are an explicitly required case and the references avoid this false conclusion, X has a material baseline error and cannot be at parity overall.",
  "shortcomings": [
    {
      "summary": "Incorrect nil-destination baseline",
      "evidence": "X states that \"`nil`, no destination, or a lone options hash raises `ActionController::UrlGenerationError: No route matches {}`\" and later calls nil \"an author error today.\" Its probe object had routes but no controller/request recall; in the checkout, `ActionView::RoutingUrlFor#url_for(nil)` delegates with `only_path`, the existing `nil_url_for` controller test expects the current action path, and a request-context probe of `<%= button_to \"Hello\", nil %>` returned status 200 with `action=\"/nil_button\"`."
    },
    {
      "summary": "The unsupported probe context also undermines adjacent no-destination conclusions",
      "evidence": "The same standalone `Probe` produced `No route matches {}` for no arguments and a lone first-position hash because it lacked normal controller URL options. X presented those outcomes as general current behavior rather than limiting them to that artificial context, while R1/R2 correctly kept nil behavior open or explicitly hypothetical."
    }
  ],
  "strengths": [
    {
      "summary": "Excellent investigation and verification breadth",
      "evidence": "X inspected the extracted `NavigationHelper` implementation, URL conversion, guides, forgery-protection tests, and all relevant navigation-helper tests; it also ran 39 filtered `button_to` tests with 40 assertions and no failures and used focused probes for escaping, legacy control output, method selection, token handling, and nested form options."
    },
    {
      "summary": "Comprehensive coverage of the requested product surface",
      "evidence": "The brief covers string and block labels, GET/POST/DELETE and inferred PATCH, remote forms, disabled controls, nested `form:` behavior, explicit tokens, false/nil/empty destinations, unsafe and HTML-safe labels, compatibility risks, actors, constraints, non-goals, examples, success signals, and open questions."
    },
    {
      "summary": "Identifies concrete compatibility hazards without prescribing an implementation",
      "evidence": "X surfaces the legacy input-versus-button default, persisted-model PATCH inference, form-level remote and Turbo data placement, method/action overwrite behavior, and the observed `form_class` leak, while explicitly keeping markup, new options, JavaScript behavior, helper internals, and test design out of the proposed solution."
    }
  ],
  "judge_thread_id": "T-01a0643e-edd8-73cd-963c-b58469ba6bee"
}
