{
  "scenario_id": "L49",
  "judge_thread_id": "T-01a06362-12ea-7372-a5ea-d63bfdf26b2a",
  "match": true,
  "rationale": "X serves the shaping request at least as well as the references: it separates tested facts from source-derived hypotheses, frames the developer pain without prematurely selecting last-good versus failed routing, and covers every requested acceptance dimension. Its claims about clear-before-load, shared application/engine reloading, watcher consumption on errors, and the two `reload_classes_only_on_change` modes agree with the checkout. The lack of an executed live reproduction is transparent and is converted into a concrete evidence-collection list rather than presented as verified behavior.",
  "shortcomings": [
    {
      "summary": "One problem statement is slightly more categorical than the evidence supports.",
      "evidence": "X says developers cannot tell the state from the next request today, although it did not run the request sequence; elsewhere it correctly labels the post-error 404/partial-table behavior as an inference and makes reproduction the next evidence step, so this does not materially undermine the brief."
    }
  ],
  "strengths": [
    {
      "summary": "It accurately traces the consequential reload and watcher behavior.",
      "evidence": "X correctly identifies that `reload!` clears all registered route sets before loading, restores the prior loaded state in `ensure`, and that both polling and evented watchers consume their update before invoking a block that may raise."
    },
    {
      "summary": "The brief is complete while staying implementation-neutral.",
      "evidence": "It defines actors, pain, desired outcomes, non-goals, initial/error/next-request/correction/simultaneous/delete examples, both reload flag modes, open product questions, and evidence to collect without prescribing code or test internals."
    },
    {
      "summary": "It handles uncertainty responsibly.",
      "evidence": "X explicitly distinguishes existing unit coverage from unexecuted HTTP outcomes and leaves last-good versus empty/erroring behavior as the central product decision rather than treating clear-first internals as the desired contract."
    }
  ]
}
