{
  "scenario_id": "S01",
  "judge_thread_id": "T-01a063d7-5cfe-71b7-994b-df2c5dfb6277",
  "match": true,
  "rationale": "X accurately traces every requested behavior and reaches the same practical guidance as both references. The implementation at activesupport/lib/active_support/testing/time_helpers.rb:133-205 supports its normalization, stubbing, microsecond, cleanup, and nested-block claims; focused tests completed with 4 runs, 29 assertions, and no failures. Its extra detail does not introduce a material error, so it is at least at reference quality overall.",
  "shortcomings": [
    {
      "summary": "The investigation and final answer were more verbose than necessary.",
      "evidence": "X.thread.md is 828 lines and repeatedly searches or rereads Time/Date conversion internals after the central implementation and full test file had already settled the behavior; one exploratory `ruby -e` command also failed because `Date` was not required. The final answer additionally lists peripheral unstubbed APIs such as `Process.clock_gettime`."
    }
  ],
  "strengths": [
    {
      "summary": "X gives especially precise coverage of indirect and inherited behavior.",
      "evidence": "X explicitly explains that `DateTime.current` is not directly stubbed and accurately clarifies inherited subclass behavior. A focused test covering timezone conversion, nested-block rejection, prior-travel restoration, and subclasses passed with 4 runs and 29 assertions, consistent with activesupport/test/time_travel_test.rb:115-151,252-265,434-452,478-491."
    }
  ]
}
