{
  "scenario_id": "L34",
  "judge_thread_id": "T-01a06361-d9bf-703f-a59a-47d8f43c8776",
  "match": false,
  "rationale": "X is exceptionally thorough on matching, per-declaration counters, waits, jitter, reporting, callbacks, instrumentation, and exhaustion, and it ran the focused exception/instrumentation tests successfully. However, it makes an explicit off-by-one claim in the very counter behavior the scenario asks it to explain: with the default `attempts: 5`, the fifth failure exhausts, not a sixth raise. The linked test passes `6` as the job's requested number of failures, but its own assertion shows only the fifth actual raise occurs before exhaustion, so this consequential flow error prevents parity with the references.",
  "shortcomings": [
    {
      "summary": "Off-by-one exhaustion claim",
      "evidence": "X says, “Default is 5: four retries then success on the fifth; a sixth raise exhausts.” The handler increments first and checks `executions < attempts`, so failure number 5 exhausts; `RetryJob.perform_later \"DefaultsError\", 6` merely ensures the job would continue failing, while the test records “Raised ... for the 5th time.”"
    }
  ],
  "strengths": [
    {
      "summary": "Broad, source-grounded control-flow analysis",
      "evidence": "X accurately covers reverse rescue-handler lookup, shared versus separate exception counters, unlimited attempts, proc arity, polynomial jitter, report timing, queue/priority restoration, callback chains, and exception escape behavior."
    },
    {
      "summary": "Meaningful focused verification",
      "evidence": "The transcript reports `AJ_ADAPTER=test bin/test test/cases/exceptions_test.rb test/cases/instrumentation_test.rb` passing with 43 runs and 0 failures."
    }
  ]
}
