{
  "scenario_id": "L37",
  "match": true,
  "rationale": "X correctly blocks the PR because removing the guard does not serialize the generated `Mail::Message`; it enqueues the original mailer class, action, delivery method, and arguments and later rebuilds the message. It comprehensively covers laziness, both later-delivery variants, parameterized mailers, custom jobs, queue selection, mutation loss, argument serialization failures, and the unaffected no-prior-access path. Its implementation and test citations support the consequential claims at least as well as the references, with no material error.",
  "shortcomings": [],
  "strengths": [
    {
      "summary": "Identifies the central serialization and observable-behavior defect precisely.",
      "evidence": "X quotes `enqueue_delivery` and `MailDeliveryJob#perform` to show that the generated message is absent from the payload and that the worker reruns the action, then correctly explains why pre-enqueue recipient, subject, and body mutations would be silently lost."
    },
    {
      "summary": "Catches the especially important parameterized-mailer regression.",
      "evidence": "X traces `Parameterized::MessageDelivery#enqueue_delivery` and correctly notes that its processed branch calls `super`, so the proposed parent change would enqueue without `params:` and cause the job to use the non-parameterized mailer path."
    },
    {
      "summary": "Covers the requested surrounding contracts and proposes an appropriately scoped direction.",
      "evidence": "The answer distinguishes `deliver_later` from `deliver_later!`, explains default and overridden queues and custom delivery jobs, separates enqueue-time argument serialization from later GlobalID deserialization, preserves the working lazy path, and recommends retaining the guard unless a distinct encoded-message delivery mode is designed and tested."
    }
  ],
  "judge_thread_id": "T-01a0643e-edd8-73cd-963c-b58469ba6bee"
}
