{
  "scenario_id": "L14",
  "match": true,
  "rationale": "X is at parity overall: it accurately establishes OrderedOptions and InheritableOptions behavior from source, tests, documentation, and a runtime probe, then turns that evidence into a nontechnical shaping brief with the requested pain, outcomes, boundaries, journeys, and acceptance evidence. It is especially strong on the indistinguishable missing/nil/false/whitespace failure cases and on preserving successful reads, dynamic access, inheritance, and ordering. It omits two secondary Hash-like details covered by the references and leaves successful-read provenance slightly inconsistent between acceptance criteria and open questions, but neither defect materially weakens the core failure-diagnosis outcome.",
  "shortcomings": [
    {
      "summary": "The current-state brief omits the symbol-only key? behavior and does not spell out inherited enumeration order.",
      "evidence": "This checkout's tests show key?(:one) is true while key?(\"one\") is false at ordered_options_test.rb L227–254, and InheritableOptions iteration is parent keys followed by child-only keys with overrides retaining position at L256–310. X preserves general symbolized enumeration order but never records these sharper compatibility edges, while both references do."
    },
    {
      "summary": "Successful inheritance provenance is both required and left open.",
      "evidence": "X's acceptance evidence says a person can tell whether a failing or succeeding required value came from child or parent, but open question 4 asks whether provenance on success is required at all. The core request is failure diagnosis, so this unresolved expansion should not have appeared as an unconditional success criterion."
    },
    {
      "summary": "One runtime probe needed a corrective rerun.",
      "evidence": "The first probe aborted when its diagnostic helper called KeyError#key and that accessor itself raised ArgumentError; X corrected the rescue logic and reran the full blank and inheritance matrix successfully. The recovery was autonomous, but the initial result alone was incomplete."
    }
  ],
  "strengths": [
    {
      "summary": "The current behavior is accurate and evidence-driven.",
      "evidence": "X traces symbolizing [] and []=, method_missing readers/writers/bang readers, respond_to_missing?, dig, Object#presence, and InheritableOptions fallback/override behavior, with mostly precise source and test links."
    },
    {
      "summary": "It directly verifies important cases missing from the test suite.",
      "evidence": "The successful probe confirms that false, nil, empty collections, empty symbols, ASCII whitespace, and non-breaking space all raise the same KeyError; 0, true, and nonblank strings succeed; inherited blank values fail; and child blank overrides hide good parent values without changing the parent."
    },
    {
      "summary": "The product problem is framed clearly without prescribing a solution.",
      "evidence": "X defines the pain as indistinguishable required-read failures, labels that diagnosis as a vetoable hypothesis, and specifies externally observable improvement without proposing methods, classes, storage, data structures, or algorithms."
    },
    {
      "summary": "Compatibility constraints and examples cover the requested core paths.",
      "evidence": "The brief preserves successful bang/non-bang values, missing quiet reads, string/symbol access, dig, respond_to?, child inheritance and override behavior, KeyError, and insertion order, with journeys for present, absent, nil, false, whitespace, inherited, overridden, and optional values."
    },
    {
      "summary": "It surfaces decisions that genuinely affect the product outcome.",
      "evidence": "The open questions isolate whether false should remain a failure, how granular blank diagnostics must be, whether exact error text is compatibility-sensitive, and how much inheritance provenance users need, preventing those choices from being smuggled into implementation."
    }
  ],
  "judge_thread_id": "T-01a0643e-a75b-730e-9a6a-4c51987df728"
}
