{
  "scenario_id": "L08",
  "judge_thread_id": "T-01a06361-05e1-774f-ba02-898a84c7e52f",
  "match": true,
  "rationale": "X correctly explains `Enumerable#sole` as a one-pass, second-yield short circuit using a separate `found` flag, with the source-established exception class and both messages. It accounts for empty, singleton, multiple, `nil`, and endless-range behavior and accurately maps Ruby's one-value, tuple, and positional-plus-keyword yields through `|*element|`. The focused source and tests are cited by path and line, so the answer is at parity with the references.",
  "shortcomings": [],
  "strengths": [
    {
      "summary": "Explains short-circuiting and nil occupancy precisely.",
      "evidence": "X shows that the second yield immediately raises `\"multiple items found\"`, so an endless range stops at 2, while `found` rather than `result.nil?` lets a lone nil remain a valid sole element."
    },
    {
      "summary": "Accurately describes Ruby yield packing.",
      "evidence": "It traces one positional value to an unwrapped scalar, multiple positional values to an Array, and `yield 1, two: 3` to `[1, { two: 3 }]`, matching the tuple and keyword focused tests."
    },
    {
      "summary": "Separates the tested Enumerable path from direct Range behavior.",
      "evidence": "X explicitly notes that `GenericEnumerable.new(1..).sole` exercises `Enumerable#sole`, while direct `(1..).sole` is a distinct Range override."
    }
  ]
}
