{
  "scenario_id": "L29",
  "match": true,
  "rationale": "X serves the user at least as well as the references: it accurately traces the controller, request-freshness, response-commit, and existing-test paths, then supplies observable controller/request checks for every required behavior. Its especially consequential expectations are correct for this checkout, including Rails 8.0 strict freshness, exact weak/strong matching, POST and QUERY taking the controller-level 304 path, subsecond Last-Modified round-tripping, and public-only Cache-Control. The answer is more expansive and its illustrative fixture is less polished than R2's, but those communication defects do not undermine the explicit matrix or lead the refactor verification strategy astray.",
  "judge_thread_id": "T-01a0624e-8d8b-7614-8538-a889fdfc0ec4",
  "shortcomings": [
    {
      "summary": "X overstates that custom etaggers exist only on ActionController::Base.",
      "evidence": "X says, 'Extra `etag { }` blocks, template digest, and flash are mixed in only on `ActionController::Base`.' In fact, `ActionController::ConditionalGet` itself defines the `etag` class method and the `etaggers` class attribute at actionpack/lib/action_controller/metal/conditional_get.rb:14-35, and ActionController::API includes ConditionalGet at actionpack/lib/action_controller/api.rb:116-124; only the default template-digest and flash etaggers are Base-specific (actionpack/lib/action_controller/base.rb:231-244)."
    },
    {
      "summary": "The proposed fixture is schematic and includes a distracting discarded version rather than one directly usable fixture.",
      "evidence": "In X's 'Fixture' section, the first version passes a `{ ... }` block to `stale?`, which does not yield, and the replacement still refers to undefined `template_opt` and `cache_opt`. X immediately rejects the first approach and the subsequent 28-row matrix fully specifies the intended observable checks, so this reduces actionability rather than correctness."
    }
  ],
  "strengths": [
    {
      "summary": "X gets two checkout-specific contract details right where R1 would create false failures.",
      "evidence": "X states that strict freshness is enabled by Rails 8.0 load defaults and that `fresh_when(etag: ..., public: true)` commits exactly `Cache-Control: public`; railties/lib/rails/application/configuration.rb:336-340 and actionpack/lib/action_dispatch/http/cache.rb:304-358 confirm both. R1 instead says '8.1+ default' and expects `max-age=0, public, must-revalidate`, while X turns the correct public-only behavior into an explicit drift detector in matrix row 19."
    }
  ]
}
