{"scenario_id":"L02","match":true,"rationale":"X matches the references overall and has no material error: it accurately separates sticky `@none` state from the non-contradictory `1=0` SQL predicate, traces both loading gates and query-cache wrappers, and covers the required calculation, membership, and bulk-write short circuits. It is especially strong on SQL-capable escape paths after further scoping; focused checkout verification passed 22 existing null/or/async/scoping tests (101 assertions) and a custom probe confirmed contradiction-only bulk writes, `none.create!`, and a null relation used as a subquery reach the adapter. Its only notable issue is that the `cache_version` example is worded unconditionally even though that query depends on collection cache versioning being enabled, which is a minor precision gap under a section about operations that can execute SQL.","shortcomings":[{"summary":"The `cache_version` SQL claim omits its configuration precondition.","evidence":"`.amp/judge-inputs/L02/X.md:150` says an unloaded none relation issues `COUNT(*)`/`MAX(timestamp)` without qualification, but `activerecord/lib/active_record/relation.rb:479-483` only calls `compute_cache_version` when `model.collection_cache_versioning` is true. A judge probe observed zero queries for `Post.none.cache_version` under the test configuration, while enabling `Topic.collection_cache_versioning` produced one query and `1 runs, 3 assertions, 0 failures`."}],"strengths":[{"summary":"It gives an accurate, maintainer-level account of the two independent null-relation mechanisms and chainability.","evidence":"`.amp/judge-inputs/L02/X.md:5-58` explains `spawn.none!`, sticky `@none`, the removable `1=0` where clause, merge propagation, `or`, and unscoping; this matches `activerecord/lib/active_record/relation/query_methods.rb:1352-1365`, `relation.rb:78-101`, and `relation/merger.rb:58-75`."},{"summary":"It precisely distinguishes loading and query-cache skip paths.","evidence":"`.amp/judge-inputs/L02/X.md:60-84,114-136` maps the outer `exec_queries` cache wrapper, the early `@none` return, the inner contradiction branch, and direct `load_async` path. The implementation confirms that ordering in `activerecord/lib/active_record/relation.rb:1472-1525,1539-1544`; existing focused tests completed with `22 runs, 101 assertions, 0 failures`."},{"summary":"It covers short circuits and the important cases where SQL can still occur.","evidence":"`.amp/judge-inputs/L02/X.md:86-112,138-154` covers calculation identities, `exists?`/`include?`, zero-result bulk writes, `or`, relation-valued predicates, inserts, and association scoping. Judge command `ARCONN=sqlite3_mem bundle exec ruby -Itest -` verified contradiction-only `delete_all`/`update_all`, `Developer.none.create!`, and `Comment.where(post_id: Post.none).count` with `1 runs, 8 assertions, 0 failures`; relevant ownership is visible in `relation.rb:602-637,1077-1096`, `relation/predicate_builder/relation_handler.rb:6-26`, and `relation.rb:155-176`."}],"judge_thread_id":"T-01a064d8-e83a-742a-b54a-e2fe9d9a5393"}
