{
  "scenario_id": "L42",
  "judge_thread_id": "T-01a06362-12ea-7372-a5ea-d63bfdf26b2a",
  "match": true,
  "rationale": "X matches the references and in several respects exceeds them: it traces the complete `config_for` pipeline, maps each requested behavior to concrete source and test ranges, and carefully separates tested contracts from untested consequences. The checkout confirms its account of ERB/Psych parsing, post-parse deep symbolization, `env:` lookup, `shared.deep_merge(config)`, shallow `OrderedOptions` wrapping, non-hash environment values, and nil/error paths. Its transcript also shows unusually strong investigation of the stale `YAML.load` stub and the historical `symbolize_names` change rather than merely repeating the test name.",
  "shortcomings": [],
  "strengths": [
    {
      "summary": "It covers every requested observable behavior with precise evidence.",
      "evidence": "X cites the implementation and named tests for ERB, explicit environments, shared deep merging, root string/symbol access, nested symbol keys, arrays, scalar environment values, absent environments, empty files, missing files, and parser compatibility."
    },
    {
      "summary": "It correctly distinguishes current execution from historical test mechanics.",
      "evidence": "X verifies that `config_for` now calls `unsafe_load_file`/`unsafe_load`, so the safe_yaml test's `YAML.stub :load` no longer intercepts parsing, while `deep_symbolize_keys` still establishes the intended compatibility contract."
    },
    {
      "summary": "The investigation is autonomous and technically rigorous.",
      "evidence": "The transcript follows the call path through `ConfigurationFile`, `deep_symbolize_keys`, `DeepMergeable`, `OrderedOptions`, path configuration, guides, tests, and the introducing git commit before drawing conclusions."
    }
  ]
}
