{
  "scenario_id": "S03",
  "judge_thread_id": "T-01a061d4-67b6-7349-b1c1-acc268536059",
  "match": true,
  "rationale": "X meets or exceeds reference parity overall: it provides a deterministic observation tuple, covers every requested behavior category, and grounds the expected results in both source inspection and an executed probe. Its encoding analysis is notably more accurate than R1, correctly preserving receiver encoding where applicable while detecting UTF-8 promotion when a UTF-8 omission is appended. Two minor test-design statements are inaccurate or incomplete, but neither undermines the strategy’s main coverage or conclusions.",
  "shortcomings": [
    {
      "summary": "X incorrectly says the existing tests miss cases where the result is strictly shorter than the byte budget.",
      "evidence": "The claim appears near the start of X, but activesupport/test/core_ext/string_ext_test.rb:351 expects the 3-byte ellipsis for budget 5, and line 356 expects it for budget 4. Those existing assertions already demonstrate unused spare bytes."
    },
    {
      "summary": "X does not include a concrete fixture combining a within-budget receiver with an equal-size or oversized omission.",
      "evidence": "The within-budget matrix only uses omissions smaller than the budgets, while the equal/oversized omission matrix uses a receiver larger than the budget. Because the within-budget check precedes omission validation at activesupport/lib/active_support/core_ext/string/filters.rb:128-134, a refactor that reordered those branches could escape X’s listed rows; R2’s empty-string-at-budget-zero case catches that ordering change."
    }
  ],
  "strengths": [
    {
      "summary": "X correctly treats result encoding as dependent on both the receiver and omission instead of claiming unconditional receiver-encoding preservation.",
      "evidence": "X’s executed probe observed UTF-8 results for ASCII-only US-ASCII and ASCII-8BIT receivers truncated with the default UTF-8 ellipsis, while an ASCII omission preserved US-ASCII. That matches the append at activesupport/lib/active_support/core_ext/string/filters.rb:136-147 and is more accurate than R1’s unqualified claim that US-ASCII and BINARY truncation keep the receiver encoding."
    },
    {
      "summary": "X verifies the proposed matrix against the checkout rather than relying only on inferred expectations.",
      "evidence": "In X.thread.md, the first broad Ruby probe exposed an uncaught low-budget omission error; X corrected the probe and reran it successfully, producing observed values for boundaries, omissions, encodings, subclass classes, identity, frozen results, and mutation isolation."
    }
  ]
}
