{
  "scenario_id": "L08",
  "match": true,
  "rationale": "X serves the user at least as well as the references: it accurately explains the empty, single-item, multi-item, nil, and endless-range cases, including the second-yield short circuit and the distinct Range#sole override. It also correctly derives the one-value, multiple-positional-value, and positional-plus-keyword yield shapes from the implementation and focused tests, with accurate exception details and source citations. Its investigation inspected the relevant implementation, exception setup, range override, helper enumerable, and focused tests, and no material omission or error remains.",
  "shortcomings": [],
  "strengths": [],
  "judge_thread_id": "T-01a0624e-7b82-75e2-9c23-ab0c2f62d69e"
}
