{
  "scenario_id": "L17",
  "match": true,
  "rationale": "X matches the references on the complete mechanism: instance state, association-time violation checks, child propagation, reporting, preload behavior, and the distinction between `:all` and `:n_plus_one_only`. Its outcomes for every requested example agree with `activerecord/test/cases/strict_loading_test.rb`, while the implementation supports the key gates in `activerecord/lib/active_record/core.rb:254-263,700-754` and `activerecord/lib/active_record/associations/association.rb:123-128,235-284`. The focused 13-test command reported by X was actually run and passed with 61 assertions, and the same command reproduced that result during judging. One sentence says the mode is not “checked” when `strict_loading!` is called even though invalid modes are validated there, but X quotes that guard and later states the invalid-mode behavior correctly, so this is not a material error.",
  "shortcomings": [
    {
      "summary": "The wording about when the mode is checked is internally imprecise.",
      "evidence": "X.md:30 says the mode is not checked at `strict_loading!` time, but `activerecord/lib/active_record/core.rb:736-742` validates it before assigning either ivar; X.md:11-24 and 212-220 nevertheless quote and explain that validation correctly."
    }
  ],
  "strengths": [
    {
      "summary": "It accurately explains both enforcement and state propagation across association hops.",
      "evidence": "X.md:28-79 distinguishes the `violates_strict_loading?` gate from `set_strict_loading`; `activerecord/lib/active_record/associations/association.rb:123-128,235-284` and `activerecord/lib/active_record/association_relation.rb:43-48` confirm that `:n_plus_one_only` permits the owner's load while making `has_many` children strict in `:all` mode and copying the mode with a false flag through singular children."
    },
    {
      "summary": "It covers all required observable cases with the correct outcomes.",
      "evidence": "X.md:113-229 covers lazy `has_many`, lazy singular associations, preload/eager load, `has_many :through` middle records, validation, multi-hop `:n_plus_one_only`, disabling, and invalid mode; the corresponding assertions appear at `activerecord/test/cases/strict_loading_test.rb:34-123,182-221,278-344,379-390,477-555,682-735`."
    },
    {
      "summary": "Its investigation is stronger than a source-only explanation and adapts to contradictory evidence.",
      "evidence": "X.thread.md:883-897 records a passing targeted run of 13 tests and 61 assertions. X.thread.md:1004-1056 shows an exploratory probe disproved the initial expectation that a `#first` child would not be strict; X then inspected `AssociationRelation#exec_queries`, removed the temporary probe, and correctly reported at X.md:197 that the collection remains unloaded while the child is strict and a nil foreign key prevents a query."
    }
  ],
  "judge_thread_id": "T-01a064d8-ef9b-729c-bbc9-214d8487d8a6"
}
